date,company,headline
2026-04-11,Apple,otterflow added to PyPI
2026-04-11,Apple,Apple Stops Accepting Orders for Some Mac Mini and Mac Studio Models
2026-04-11,Apple,Several Mac mini and Mac Studio configs are now completely out of stock at Apple
2026-04-11,Apple,Fix your home’s Wi-Fi dead zones for just $28
2026-04-11,Apple,Alani Nu Energy Drink: 10 Must-Know Facts on Viral Zero-Sugar Boost as Sales Soar
2026-04-11,Apple,"ICYMI: the 7 biggest tech stories of the week, from DJI's new robovac to Artemis II iPhone photos"
2026-04-11,Apple,The GLP-1 gold rush is creating winners far beyond pharma
2026-04-11,Apple,Memestocks are Spreading
2026-04-11,Apple,Has r/WallStreetBets Broken Containment?
2026-04-11,Apple,Economic Digest: Nepal’s Business News in a Snap
2026-04-11,Apple,finbase added to PyPI
2026-04-10,Apple,Walmart Marketplace Powers General Merchandise Surge
2026-04-10,Apple,BOOKstore Economics
2026-04-10,Apple,Mantle’s xStocks Rollout Pushes Tokenized Equities Closer to Real Onchain Liquidity
2026-04-10,Apple,"UFC 327 preview, ‘Jiri vs. Ulberg’ main card predictions"
2026-04-10,Apple,"Retro NYC video store marks booming first year in business – thanks to growing Gen-Z demand for VHS, DVDs"
2026-04-10,Apple,Lackluster Foldable Smartphone Sales Are About To Witness A Major Surge As Apple Increases iPhone Fold Display Inventory By 20%
2026-04-10,Apple,CNN’s Aaron Blake Calls Out Trump for ‘Publicly Promoting the Business of a Donor’ Amid Palantir Slide
2026-04-10,Apple,Exodus Rolls Out 'Exodus Pay' to Turn Bitcoin Wallet Into Spending App
2026-04-10,Apple,PSA: AirPods Pro 3 are dropping back down to holiday pricing this weekend
2026-04-10,Apple,"Deals: All 15-inch M5 MacBook Air models $150 off, Series 11 $99 off, Nomad leather iPhone 17 cases, more"
2026-04-10,Apple,SpaceX could be the biggest IPO in history. Will investors see a return?
2026-04-10,Apple,How many employees does Home Depot have?
2026-04-10,Apple,"New iPhone Fold leaks cover ‘Ultra’ name, launch timing, more"
2026-04-10,Apple,Morning Minute: Bitcoin Breaks $73K as Strategy's STRC Bid Grows
2026-04-10,Apple,"Live again: Most affordable M5 MacBook Pro you can buy down at $1,400 on Amazon ($299 under the model Apple sells)"
2026-04-10,Apple,Retail Stock Traders Turn Into Sellers as Rally Spurs Skepticism
2026-04-10,Apple,Alphabet steamrolled BI's stock bracket. Here are 4 things your picks revealed.
2026-04-10,Apple,Top-Performing Africa Fund Wagers on Urbanization to Drive Gains
2026-04-10,Apple,What Anthropic’s too-dangerous-to-release AI model means for its upcoming IPO
2026-04-10,Apple,Champ’s Choice: Rory McIlroy served himself first at Augusta
2026-04-10,Apple,From Japanese ‘swicy’ to Mexican smoke: How to cook like a flavour tourist at home
2026-04-09,Apple,"20VC x SaaStr: Anthropic Hit $30 Billion and Training Costs a Quarter of OpenAI’s, SpaceX Files at $1.75 Trillion, and Why the Big Three Will Dwarf Every IPO of the Last 25 Years Combined"
2026-04-09,Apple,"BAB, Inc. Reports Results for 1st Quarter FY 2026"
2026-04-09,Apple,I Can’t Believe I Just Found This For $16 On Amazon
2026-04-09,Apple,"Toll Brothers Announces New Luxury Home Community Coming Soon to Southeast, New York"
2026-04-09,Apple,Refurb Unlocked Apple iPhone 16 Pro Max 512GB Smart Phone for $824 + free shipping
2026-04-09,Apple,Goldman Sachs spots a buying opportunity in bruised Big Tech
2026-04-09,Apple,Amazon Outlet Electronics Deals: Up to 70% off + free shipping w/ Prime
2026-04-09,Apple,More defensive versatility? Best safety fits for Patriots in NFL Draft
2026-04-09,Apple,Wedbush: What You Need to Know About the Latest ‘Victory’ for Apple Stock
2026-04-09,Apple,"Deals: 1TB M5 MacBook Air $150 off, Apple Thunderbolt 5 cables up to 48% off, Magic Keyboard Amazon low, more"
2026-04-09,Apple,Wedbush Is Bullish on Magnificent 7 Amid the 2-Week Ceasefire. Nvidia Is the Top-Rated Stock to Buy Now.
2026-04-09,Apple,"Investors are getting the SpaceX IPO wrong, and the real value is in its 'sovereign AI,' hedge fund manager Gene Munster says"
2026-04-09,Apple,Apple card - 5%/$500 Walgreens offer
2026-04-09,Apple,Want a piece of SpaceX? Smart ways to invest before Elon Musk’s company goes public
2026-04-09,Apple,New acting AG plans to operate as Trump’s personal lawyer
2026-04-09,Apple,Apple’s iPhone Fold dummies look horrible in these leaked photos - PhoneArena
2026-04-09,Apple,DIY MacBook Neo upgrade can boost the SSD to 1TB using iPhone parts
2026-04-09,Apple,3 charts reveal Big Tech's biggest problem this earnings season
2026-04-09,Apple,Pierre Poilievre went on Joe Rogan to expose ‘biggest fraud’ crushing everyday Americans — shockproof your wealth now
2026-04-09,Apple,"Refurb Apple iPad Pro M4 13"" 256GB WiFi Tablet for $778 + free shipping"
2026-04-09,Apple,Warren Buffett's Timeless Wisdom: 10 Best Quotes That Still Guide Investors in 2026
2026-04-09,Apple,"Refurb 4th-Gen. Apple iPad Air 10.9"" 64GB Tablet (2020) for $240 + free shipping"
2026-04-09,Apple,Amazon’s rare $99 price drops on Apple Watch Ultra 3 join refurb deals at $164 off
2026-04-09,Apple,Morning Brief: Where things stand with Iran
2026-04-09,Apple,Best Crypto Apps for Beginners
2026-04-09,Apple,10 Stocks Warren Buffett Has Been Buying in 2026 Revealed: Berkshire's Latest Portfolio and Cash Moves
2026-04-09,Apple,Apple's Foldable iPhone Is 'On Track' To Launch In September
2026-04-09,Apple,iOS 26.4: Here Are the Game-Changing Features You’ll Love
2026-04-09,Apple,Tech problems? Even astronauts can’t outrun them
2026-04-08,Apple,"Apple iPad Pro 11"" M5 Wi-Fi 256GB $1585 + Postage @ Mwave ($1505.75 Price Beat @ Officeworks)"
2026-04-08,Apple,"TSLA stock slides, Supercharger prices, and who’s REALLY behind Elon’s big chip fab"
2026-04-08,Apple,Own Your Router with Open-Source Firmware
2026-04-08,Apple,"Morgan Stanley, Evercore: Apple’s foldable iPhone on track for September launch"
2026-04-08,Apple,"Amazon has M5 MacBook Pro down at $1,400 right now ($299 under the most affordable model Apple sells)"
2026-04-08,Apple,Apple’s stock pares losses. Here’s how to think about the latest saga with foldable iPhones. - MarketWatch
2026-04-08,Apple,FEDS Note: India and the Global Economy
2026-04-08,Apple,"Today’s Top Deals: Apple Watch Ultra 3, MTG x Avatar Scene Box, and Yakuza 0 for Switch 2"
2026-04-08,Apple,"iPhone Fold release date changes once again, but it’s good news this time"
2026-04-08,Apple,These stars are the newest members of the billionaires club
2026-04-08,Apple,"Jelly Lean: The TRUTH Behind the ""Jello Trick"" and ""Pink Gelatin Trick"" Weight-Loss Buzz"
2026-04-08,Apple,Felix launches with $1.7M to reliably automate professional services
2026-04-08,Apple,Apple stock is the new retail investor darling
2026-04-08,Apple,"Morgan Stanley Just Downgraded Arm Stock on Chipmaking Pivot. Why, and Should You Sell ARM Now?"
2026-04-08,Apple,Fogarty: 'We want to turn one of these teams over'
2026-04-08,Apple,Alphabet Class C Shares Surge 3.3% to $313.96 on AI Momentum and Broadcom Partnership
2026-04-08,Apple,Show HN: OS Megakernel that match M5 Max Tok/w at 2x the Throughput on RTX 3090
2026-04-08,Apple,Supply Chain Constraints Threaten MacBook Neo Pricing Following Surge In Demand
2026-04-08,Apple,Want a MacBook Neo? You'll be waiting 2-3 weeks for delivery — and rumor has it delays could get much worse
2026-04-08,Apple,Biggest problem with the MacBook Neo? It’s too popular!
2026-04-08,Apple,Morgan Stanley has a stark message for investors in Apple
2026-04-08,Apple,Goldman Sachs Cautious on QUALCOMM (QCOM) Amid Key Customer Losses
2026-04-08,Apple,Stocks Soar as US and Iran Agree to a Ceasefire
2026-04-08,Apple,10 Stocks Warren Buffett Has Been Aggressively Selling in 2026 as Berkshire Builds Record Cash
2026-04-08,Apple,Apple’s first foldable iPhone still on track for September launch – Gurman
2026-04-08,Apple,Big new discount turns the Google Pixel 10 into a bestseller
2026-04-08,Apple,"Morning Minute: Crypto Soars, Oil Tumbles on 2-Week Ceasefire"
2026-04-08,Apple,Why the MacBook Neo 2 may arrive sooner than expected
2026-04-08,Apple,How Can Meta Stock Fall 30%?
2026-04-08,Apple,Morning Brief: Chicago Fed's Goolsbee 'nervous' about impact of oil shock on economy
2026-04-08,Apple,China intervenes in memory supply; Apple outpaces local smartphone vendors
2026-04-08,Apple,Intel Jumps On Board Elon Musk’s Terafab Chipmaking Project
2026-04-08,Apple,AI for the People
2026-04-08,Apple,Bill Ackman channels Warren Buffett with his $64 billion bid for Universal Music Group
2026-04-08,Apple,"Nvidia, Apple, and Alphabet Could Help This Marvelous Vanguard ETF Turn $250,000 Into $1 Million After the Stock Market Sell-Off"
2026-04-08,Apple,"You can buy Apple, Amazon, and Tesla shares sitting in India; here's exactly how to do it"
2026-04-08,Apple,Goldman Sachs Spots Buying Opportunity in Bruised Big Tech
2026-04-11,Tesla,Anthony Scaramucci Says He Owns SpaceX Stock And Won't Miss Out On The IPO Despite Elon Musk's 'Cult Of Personality' Premium
2026-04-11,Tesla,Is It Too Late to Buy Tesla Stock?
2026-04-11,Tesla,'Big Short' investor Michael Burry lays out why he thinks high-flying tech stocks are even pricier than you think
2026-04-11,Tesla,Tesla Stock Investors Just Got Good News From Wall Street Analysts About Robotaxis
2026-04-11,Tesla,"Tesla slides, but valuation still looks wildly detached from reality"
2026-04-11,Tesla,Tesla stock shaky after new model denial
2026-04-11,Tesla,"Tesla's supervised self-driving software gets Dutch okay, first in Europe"
2026-04-11,Tesla,Elon Musk’s Top Tips That Will Save Retirees From Financial Disaster
2026-04-10,Tesla,Mantle’s xStocks Rollout Pushes Tokenized Equities Closer to Real Onchain Liquidity
2026-04-10,Tesla,Cathie Wood Doubles Down On Tesla Amid 60% Downside Warning: Ark Adds Another $11.4 Million Worth Of TSLA Stock
2026-04-10,Tesla,"Amazon is still paying Jeff Bezos an $80,000 yearly salary—but $1.6 million for travel and security"
2026-04-10,Tesla,SMPL Securities Alert: Simply Good Foods Securities Fraud Investigation Focuses on Expansion Issues; BFA Law Notifies Investors to Contact the Firm
2026-04-10,Tesla,Vanda Research Says Retail Investors are Buying the Tesla Stock Dip. Should you?
2026-04-10,Tesla,A market analyst shares why he thinks Tesla is the 'single greatest stock short' in market history
2026-04-10,Tesla,These 3 Unusually Active Mag 7 Calls Are Great Hail Mary Bets for Under $100
2026-04-10,Tesla,Intel Stock Hits Fresh 52-Week High at $62.34 as AI Partnerships Fuel Turnaround Momentum
2026-04-10,Tesla,Smart Money Is Not Buying Trump’s ‘Ceasefire’ with Iran
2026-04-10,Tesla,ceointerviews-mcp added to PyPI
2026-04-10,Tesla,The unconventional logic behind SpaceX's $1.75 trillion price tag
2026-04-10,Tesla,Retail Stock Traders Turn Into Sellers as Rally Spurs Skepticism
2026-04-10,Tesla,ADMA Securities Alert: ADMA Biologics Securities Fraud Investigation Focuses on Channel Stuffing Claims; BFA Law Notifies Investors to Contact the Firm
2026-04-10,Tesla,DRVN Securities Alert: Driven Brands Securities Fraud Class Action Focuses on Financial Restatements; BFA Law Notifies Investors of May 8 Court Deadline
2026-04-10,Tesla,SMR Securities Alert: NuScale Power Securities Fraud Class Action Focuses on ENTRA1 Issues; BFA Law Notifies Investors of April 20 Court Deadline
2026-04-10,Tesla,WLFC Securities Alert: Willis Lease Finance Investigation Focuses on Executive Compensation; BFA Law Notifies Shareholders to Contact the Firm
2026-04-10,Tesla,MCW Securities Alert: Mister Car Wash Investigation Focuses on $7 Transaction Price – BFA Law Notifies Shareholders to Contact the Firm
2026-04-10,Tesla,TNC Securities Alert: Tennant Company Securities Fraud Investigation Focuses on ERP System Issues; BFA Law Notifies Investors to Contact the Firm
2026-04-10,Tesla,EOSE Securities Alert: Eos Energy Securities Fraud Class Action Focuses on Manufacturing Issues; BFA Law Notifies Investors of May 5 Court Deadline
2026-04-10,Tesla,Alphabet steamrolled BI's stock bracket. Here are 4 things your picks revealed.
2026-04-09,Tesla,"Down More Than 30% from All-Time Highs, Should You Buy the Tesla Stock Dip?"
2026-04-09,Tesla,Google Cloud deepens AI infrastructure partnership with Intel across Xeon and custom chips
2026-04-09,Tesla,"Intel Stock Surges Past $60 as Analyst Upgrade, Terafab Partnership and Foundry Momentum Fuel Turnaround Hopes"
2026-04-09,Tesla,Polestar 3 SUV Deals Target Tesla Owners With Massive $21K Discount
2026-04-09,Tesla,"Tesla secretly working on new, smaller, cheaper electric SUV: report"
2026-04-09,Tesla,"Tesla stock is sliding, but Cathie Wood just bet $14 million that everyone else is wrong"
2026-04-09,Tesla,Elon Musk says Tesla only has 'a few hundred' Model S and X in stock as the vehicles near end of life cycle
2026-04-09,Tesla,Goldman Sachs spots a buying opportunity in bruised Big Tech
2026-04-09,Tesla,"Tesla is developing a new smaller, cheaper EV, Reuters sources say"
2026-04-09,Tesla,Wedbush Is Bullish on Magnificent 7 Amid the 2-Week Ceasefire. Nvidia Is the Top-Rated Stock to Buy Now.
2026-04-09,Tesla,Show HN: Our Next Decade – A curated forecast of the next ten years
2026-04-09,Tesla,Tesla vs. Ford: Don’t Buy Either Stock Until You Read This
2026-04-09,Tesla,"Tesla Rumored To Be In Talks With Suppliers Over Smaller, Cheaper Crossover, But We'll Believe It When We See It"
2026-04-09,Tesla,Want a piece of SpaceX? Smart ways to invest before Elon Musk’s company goes public
2026-04-09,Tesla,SpaceX IPO Heats Up to $1.75T Valuation Amid Unprecedented Retail Interest
2026-04-09,Tesla,Scaling Lithium Operations to Meet Surging Global Demand
2026-04-09,Tesla,3 charts reveal Big Tech's biggest problem this earnings season
2026-04-09,Tesla,"What Do SpaceX, xAI, And X Have In Common? Is It Tesla?"
2026-04-09,Tesla,A New Theory of Elon Musk
2026-04-09,Tesla,The world's 20 richest people are $90 billion wealthier after the US-Iran ceasefire sparked a big stock rally
2026-04-09,Tesla,China Watches Trump Blink
2026-04-09,Tesla,"Tesla is developing a new smaller, cheaper EV, sources say"
2026-04-09,Tesla,How the math works behind a $1.75 trillion SpaceX valuation
2026-04-09,Tesla,Tesla Stock's Rough Year Continues. Time to Buy the Stock?
2026-04-08,Tesla,"TSLA stock slides, Supercharger prices, and who’s REALLY behind Elon’s big chip fab"
2026-04-08,Tesla,JPMorgan Is Still Betting That Tesla Stock Will Plunge 60% from Here
2026-04-08,Tesla,Tesla Must Reckon with a ‘Material Collapse’ in Performance Ahead of Earnings. What Will the Outcome Be for TSLA Stock?
2026-04-08,Tesla,Intel joins Musk’s Terafab as foundry partner in $25B chip megaproject
2026-04-08,Tesla,Tesla Missed Q1 Delivery Expectations. Can TSLA Stock Survive Yet Another Blow?
2026-04-08,Tesla,Stocks Soar as US and Iran Agree to a Ceasefire
2026-04-08,Tesla,Tesla (TSLA) down 20% in 2026 — JPMorgan sees another 60% downside
2026-04-08,Tesla,Why Oracle’s new CFO Hilary Maxson is key to its AI ambitions
2026-04-08,Tesla,How the math works on a $1.75 trillion SpaceX valuation
2026-04-08,Tesla,"Iran ceasefire, Delta earnings, the Navy's retail woes and more in Morning Squawk"
2026-04-08,Tesla,Retail investors are buying the dip in Tesla stock
2026-04-08,Tesla,Tesla stock crashes 23% YTD before earnings but TSLA jumps 5% in today’s premarket — is FSD breakthrough and robotaxi hype enough to revive Tesla shares now?
2026-04-08,Tesla,ADMA Investor Announcement: ADMA Biologics Investigated After Channel Stuffing Claims Cause 29% Stock Drop – Investors with Losses Notified to Contact BFA Law
2026-04-08,Tesla,WLFC Investor Announcement: Willis Lease Finance Board Investigated Over Executive Compensation – Current Shareholders Notified to Contact BFA Law
2026-04-08,Tesla,DRVN Investor Announcement: Driven Brands Sued After Financial Restatements Cause 39% Stock Drop – Investors with Losses Notified to Contact BFA Law
2026-04-08,Tesla,TNC Investor Announcement: Tennant Company Investigated After ERP System Issues Cause 23% Stock Drop – Investors with Losses Notified to Contact BFA Law
2026-04-08,Tesla,MCW Investor Announcement: Mister Car Wash Board Investigated After $7 Take Private Deal Announced – Current Shareholders Notified to Contact BFA Law
2026-04-08,Tesla,CWH Investor Announcement: Camping World Sued After Inventory Management Issues Cause 24% Stock Drop – Investors with Losses Notified to Contact BFA Law
2026-04-08,Tesla,EOSE Investor Announcement: Eos Energy Sued After Manufacturing Issues Cause 39% Stock Drop – Investors with Losses Notified to Contact BFA Law
2026-04-08,Tesla,SMR Investor Announcement: NuScale Power Sued After ENTRA1 Issues Cause 12% Stock Drop – Investors with Losses Notified to Contact BFA Law
2026-04-08,Tesla,Tesla Stock Pulled Back 26.2% After a Monster Run. Is It Time to Buy the Dip?
2026-04-08,Tesla,"Elon Musk's Viral 'Lol' Mocks 8-Year 'Sell Tesla' Call as Stock Soars 1,100% in 2026"
2026-04-08,Tesla,How the math works on a $1.75 trillion SpaceX valuation
2026-04-08,Tesla,Intel Jumps On Board Elon Musk’s Terafab Chipmaking Project
2026-04-08,Tesla,"You can buy Apple, Amazon, and Tesla shares sitting in India; here's exactly how to do it"
2026-04-08,Tesla,Goldman Sachs Spots Buying Opportunity in Bruised Big Tech
2026-04-08,Tesla,The Pentagon Has 268 Days to Replace America’s Most Critical Supply Chain
2026-04-07,Tesla,"Oil Falls, US Stock Futures Gain on Ceasefire Bets: Markets Wrap"
2026-04-07,Tesla,"US stocks close mixed, with signs of progress as Trump’s Iran deadline draws near"
2026-04-07,Tesla,JPMorgan has a stark warning on Tesla stock
2026-04-07,Tesla,Stocks Recover on Iran Ceasefire Hopes
2026-04-07,Tesla,Intel joins Elon Musk’s Terafab chip manufacturing initiative
2026-04-07,Tesla,"US stocks today: US stocks close mixed, with signs of progress as Trump's Iran deadline draws near"
2026-04-07,Tesla,Top Analyst Bearish On Elon Musk's Tesla Over 'Collapsed' Financial Expectations—Jim Cramer Says Could Trigger TSLA Stock Sell-Off Amid SpaceX IPO
2026-04-07,Tesla,Intel signs on to Elon Musk's Terafab chips project | TechCrunch
2026-04-07,Tesla,"Cramer Flags New Trade: Sell Some Tesla, Wait for SpaceX IPO?"
2026-04-07,Tesla,JP Morgan Concerned Tesla Stock Will Crash by 60 Percent in Face of Ongoing Business Failures
2026-04-07,Tesla,A Faulty Weld Stopped Gravity Deliveries for 29 Days and Lucid Stock Is Down 64% Over the Past Year
2026-04-07,Tesla,Global markets fall ahead of Trump’s deadline for Iran
2026-04-07,Tesla,"Due to the memory chip shortage, prices of devices including Apple, Samsung, Xiaomi, and Google Pixel have risen unexpectedly."
2026-04-07,Tesla,California overtakes Japan to become world’s 4th-largest economy - here’s what changed
2026-04-07,Tesla,Intel joins Tesla's TeraFab chip project with SpaceX and xAI to meet growing demand for AI and robotics
2026-04-07,Tesla,The dividend yield on the S&P 500 is now at 50-year lows. Here's the biggest problem.
2026-04-07,Tesla,"Why US stock market crashes today? Dow, S&P 500 and Nasdaq in deep red – Iran tensions rise and surging oil prices shake Wall Street"
2026-04-07,Tesla,Intel stock jumps after it joins Elon Musk's Terafab chip-building moonshot
2026-04-07,Tesla,"A generational buying opportunity has opened up for U.S. tech stocks, says Goldman Sachs"
2026-04-11,Microsoft,The Leading Public Software Companies Are Now Down -50% in the Last 6 Months
2026-04-11,Microsoft,NVIDIA vs AMD 2026: AI Chip Showdown – Who Dominates Data Centers as Blackwell and MI400 Battle?
2026-04-11,Microsoft,Vodafone’s stock market rebound risks losing reception
2026-04-10,Microsoft,New Xbox Game Pass Day One Game Has a 96% Audience Score
2026-04-10,Microsoft,"This TSX oilsands major could jump as much as 20% on the Iran war and Strait of Hormuz crisis, analyst says"
2026-04-10,Microsoft,Muslim Capitalism And The Rise of Tech and VC Culture: Are We Going Down The Technological Lizard Hole?
2026-04-10,Microsoft,CNN’s Aaron Blake Calls Out Trump for ‘Publicly Promoting the Business of a Donor’ Amid Palantir Slide
2026-04-10,Microsoft,"The FCC says foreign routers are a security risk, but still allows firmware updates to the ones you already own"
2026-04-10,Microsoft,Alphabet Stock Edges Higher as AI Momentum and Cloud Surge Offset Massive 2026 CapEx Concerns
2026-04-10,Microsoft,"IREN Stock Surges 8% as Bitcoin Miner Turns AI Cloud Powerhouse With 150,000 GPU Expansion Push"
2026-04-10,Microsoft,Anthropic tries to keep its new AI model away from cyberattackers as enterprises look to tame AI chaos
2026-04-10,Microsoft,"State Street Digital Transformation Strategy Analysis Report 2025: Accelerators, Innovation Programs, Technology Initiatives, ICT, Partnerships, Investments & Acquisitions, Network Map"
2026-04-10,Microsoft,Is Amazon The Best AI Cloud Stock in Billionaire Ken Fisher’s Portfolio?
2026-04-10,Microsoft,Every fusion startup that has raised over $100M | TechCrunch
2026-04-10,Microsoft,Is Microsoft Stock A Smarter Buy Than Google After Its Massive 250% Rally?
2026-04-10,Microsoft,Is Microsoft (MSFT) The Best AI Stock According to Billionaire Ken Fisher?
2026-04-10,Microsoft,Retail Stock Traders Turn Into Sellers as Rally Spurs Skepticism
2026-04-10,Microsoft,Microsoft: The Selloff Looks Better Than The Story (NASDAQ:MSFT) - Seeking Alpha
2026-04-10,Microsoft,What Anthropic’s too-dangerous-to-release AI model means for its upcoming IPO
2026-04-10,Microsoft,Publication of 2025 Annual Report
2026-04-10,Microsoft,Meta Platforms says it will spend an additional $21B on CoreWeave’s AI infrastructure
2026-04-09,Microsoft,Yobi teams with Microsoft to deliver predictive consumer intelligence on Azure
2026-04-09,Microsoft,"Meta commits another $21 billion to CoreWeave, bringing total AI cloud spend to $35 billion"
2026-04-09,Microsoft,Micron Stock Rockets Toward $420 on Explosive AI Memory Demand and Record Q3 Guidance
2026-04-09,Microsoft,Corning Stock Surges Past $170 on AI Fiber Optics Boom and Upgraded Growth Targets
2026-04-09,Microsoft,Nebius Group Stock Rockets Above $134 on Massive AI Deals and Cantor Overweight Initiation
2026-04-09,Microsoft,Hut 8 Stock Explodes Past $63 on AI Data Center Pivot as Bitcoin Miner Transforms Into Powerhouse
2026-04-09,Microsoft,Bloom Energy Stock Rockets 7.3% Past $157 as AI Data Center Power Crunch Drives Fuel Cell Demand
2026-04-09,Microsoft,"Intel Stock Surges Past $60 as Analyst Upgrade, Terafab Partnership and Foundry Momentum Fuel Turnaround Hopes"
2026-04-09,Microsoft,World's smallest violin spotted at Amazon HQ as exec pay packets deflate
2026-04-09,Microsoft,Amazon Stock Jumps 4.5% as AI Optimism Eases Fears Over $200 Billion CapEx Spending Spree
2026-04-09,Microsoft,Goldman Sachs spots a buying opportunity in bruised Big Tech
2026-04-09,Microsoft,Wedbush Is Bullish on Magnificent 7 Amid the 2-Week Ceasefire. Nvidia Is the Top-Rated Stock to Buy Now.
2026-04-09,Microsoft,US software stocks fall as Anthropic's new AI model revives disruption fears
2026-04-09,Microsoft,US software stocks slump on renewed AI disruption jitters
2026-04-09,Microsoft,US software stocks fall as Anthropic's new AI model revives disruption fears
2026-04-09,Microsoft,1 Growth Stock Smart Money Is Buying Aggressively
2026-04-09,Microsoft,Refiant raises $5M to refine AI models with ‘nature-inspired’ energy efficiency
2026-04-09,Microsoft,Zencoder launches AI platform to automate the surrounding work that coding agents don’t handle
2026-04-09,Microsoft,3 charts reveal Big Tech's biggest problem this earnings season
2026-04-09,Microsoft,Pierre Poilievre went on Joe Rogan to expose ‘biggest fraud’ crushing everyday Americans — shockproof your wealth now
2026-04-09,Microsoft,"What Do SpaceX, xAI, And X Have In Common? Is It Tesla?"
2026-04-09,Microsoft,"Hades 2, the Award-Winning Sequel, Lands on Xbox Game Pass Soon"
2026-04-09,Microsoft,The world's 20 richest people are $90 billion wealthier after the US-Iran ceasefire sparked a big stock rally
2026-04-09,Microsoft,Meta commits to spending additional $21 billion with CoreWeave as AI costs keep rising
2026-04-09,Microsoft,Microsoft Price Prediction: The Tech Stock Can Soar to $800 in 2030
2026-04-09,Microsoft,Bill Gates Selling These 5 Stocks in 2026: Foundation Trims Holdings to Fuel Philanthropy
2026-04-09,Microsoft,Tech problems? Even astronauts can’t outrun them
2026-04-08,Microsoft,Why A $50 Price Target On AR Could Be About More Than Just Energy
2026-04-08,Microsoft,Analysts See Massive Upside in Microsoft: Time to Buy MSFT Stock?
2026-04-08,Microsoft,CoBank Quarterly: Economic fallout of rising fuel and energy costs will be most acute in rural America
2026-04-08,Microsoft,Felix launches with $1.7M to reliably automate professional services
2026-04-08,Microsoft,"Billions of users, millions of cores: Inside the high-stakes fight over end-user computing"
2026-04-08,Microsoft,The single-vendor world is collapsing — and Dell and Nutanix say AI factories are finishing the job
2026-04-08,Microsoft,Alphabet Class C Shares Surge 3.3% to $313.96 on AI Momentum and Broadcom Partnership
2026-04-08,Microsoft,Nutanix signals an infrastructure shift in AI — theCUBE’s .NEXT keynote analysis
2026-04-08,Microsoft,Want a MacBook Neo? You'll be waiting 2-3 weeks for delivery — and rumor has it delays could get much worse
2026-04-08,Microsoft,Is Microsoft (MSFT) One of the Hedge Fund Favorites with Strong Setup in 2026?
2026-04-08,Microsoft,Stocks Soar as US and Iran Agree to a Ceasefire
2026-04-08,Microsoft,Regal AI launches Copilot for building self-improving voice AI agents
2026-04-08,Microsoft,"India doing better than Asian peers, well placed to attract more foreign investment: RBI"
