date,company,headline
2026-04-08,Microsoft,"India doing better than Asian peers, well place to attract more foreign investment: RBI"
2026-04-08,Microsoft,Asus ROG Xbox Ally review: The cheapest Windows handheld gets points for showing up
2026-04-08,Microsoft,"Palantir's AI Powers US Strikes in Iran War, Speeding 'Kill Chain' in First Major AI-Driven Conflict"
2026-04-08,Microsoft,Morning Brief: Chicago Fed's Goolsbee 'nervous' about impact of oil shock on economy
2026-04-08,Microsoft,"Prediction: This AI Stock Will Be Worth More Than Microsoft, Alphabet, and Palantir Combined by 2030"
2026-04-08,Microsoft,Goldman Sachs Spots Buying Opportunity in Bruised Big Tech
2026-04-08,Microsoft,"Copilot Is 'For Entertainment Only' — What Claude, ChatGPT, and Gemini Say in Their Fine Print"
2026-04-08,Microsoft,"Anthropic debuts Project Glasswing, an initiative that will leverage its powerful Mythos model to reinforce software security"
2026-04-08,Microsoft,Synthetic super-enhancers enable precision viral immunotherapy
2026-04-07,Microsoft,Nutanix .NEXT 2026: The great replatforming has begun
2026-04-07,Microsoft,The AI trade is over. Top Wall Street analysts say the AI opportunity might be just starting
2026-04-07,Microsoft,"As Bulls and Bears Battle Over AI, $350 Is the Key Number to Watch for Microsoft Stock"
2026-04-07,Microsoft,"Hades 2, the Award-Winning Sequel, Joins Xbox Game Pass in April"
2026-04-07,Microsoft,"LG C6 vs. LG C5: I compared two generations of OLED TVs, and it was pretty darn close"
2026-04-07,Microsoft,"Anthropic’s dispute with US government exposes deeper rifts over AI governance, risk and control"
2026-04-07,Microsoft,Hapax serves up proactive AI platform designed to meet business needs
2026-04-07,Microsoft,DxO FilmPack 7.22.0.23
2026-04-07,Microsoft,The dividend yield on the S&P 500 is now at 50-year lows. Here's the biggest problem.
2026-04-07,Microsoft,Alphabet Shares Dip 0.47% as Investors Weigh AI Spending vs. Antitrust Risks Ahead of Q1 Earnings
2026-04-07,Microsoft,"Game Pass adds Kiln, Hades II, Vampire Crawlers: The Turbo Wildcard from Vampire Survivors, and more in April"
2026-04-07,Microsoft,Amazon Stock Is Stuck in a Bubble of Digital Landlords: How to Skip the Middlemen and Invest the Right Way in AI
2026-04-07,Microsoft,"Software isn't dying, it's just disappearing from our view"
2026-04-07,Microsoft,Bank of America resets Apple stock forecast
2026-04-07,Microsoft,Microsoft Stock Is Down 30% From Its Peak. History Says This Is What Happens Next.
2026-04-07,Microsoft,Inside Big Software's fight for its life
2026-04-07,Microsoft,Wells Fargo Maintains Overweight Rating for Advanced Micro Devices (AMD)
2026-04-07,Microsoft,Agentic AI startup NeuBird raises $19.3M to help human site reliability engineers rise from the ashes of alert fatigue
2026-04-07,Microsoft,"Oracle appoints Hilary Maxson as CFO amid major layoffs — What we know about her salary, stock options"
2026-04-07,Microsoft,"U.S. Stock Market prediction for Tuesday: How will S&P 500, Dow Jones, Nasdaq trade? Investors will eye these points"
2026-04-06,Microsoft,Building for AI: Hybrid cloud strategy and partnerships power Nutanix’s ISV edge
2026-04-06,Microsoft,Stocks Drift Higher Ahead of Trump's Iran Deadline
2026-04-06,Microsoft,2 reasons why Microsoft stock has been shredded
2026-04-06,Microsoft,Nebius Stock: A Hidden AI Gem or Too Risky to Touch?
2026-04-06,Microsoft,Alphabet Stock Rises Modestly as Analysts Affirm GOOG as Long-Term Buy on AI and Cloud Strength
2026-04-06,Microsoft,The $100B question: AI’s appetite for compute is rewriting the rules of tech
2026-04-06,Microsoft,Consumer hardware trade in danger as Iran war triggers memory chip pricing explosion
2026-04-06,Microsoft,How You Can Use Unusual Options Activity to Stalk Big-Money Trades
